question_text,source_url,category,type
Takes on challenging questions and provides instant answers.,https://hr-survey.com/360_Survey_Example_1.htm,communication,scraped
Coaches others on their written communication skills,https://hr-survey.com/360_Survey_Example_1.htm,communication,scraped
Addresses issues of key importance to stakeholders.,https://hr-survey.com/360_Survey_Example_1.htm,communication,scraped
"Communicates goals of project, resources required, resources available, etc. to the team",https://hr-survey.com/360_Survey_Example_1.htm,communication,scraped
Articulates ideas and emotions clearly to others.,https://hr-survey.com/360_Survey_Example_1.htm,communication,scraped
Gives clear and convincing presentations.,https://hr-survey.com/360_Survey_Example_1.htm,communication,scraped
Adapts language and terminology to meet the needs of the audience.,https://hr-survey.com/360Feedback_Sample_Assessment_Form.htm,communication,scraped
Recaps action steps from meetings to ensure clarity and execution.,https://hr-survey.com/360Feedback_Sample_Assessment_Form.htm,communication,scraped
Considers the audience in how the communication is presented.,https://hr-survey.com/360Feedback_Sample_Assessment_Form.htm,communication,scraped
"Responds in a timely manner, respecting deadlines and others' schedules.",https://hr-survey.com/360Feedback_Sample_Assessment_Form.htm,communication,scraped
"When when explaining changes, I explain concepts in a structured manner.",generated_by_templates,communication,generated
"When when receiving criticism, I ask questions clearly and concisely.",generated_by_templates,communication,generated
My verbal communication is engaging and persuasive.,generated_by_templates,communication,generated
I persuade in presentations with empathy.,generated_by_templates,communication,generated
I am skilled at communicate effectively.,generated_by_templates,communication,generated
"During project review meetings, I mediate discussions while maintaining attention.",generated_by_templates,communication,generated
I am skilled at explain concepts effectively.,generated_by_templates,communication,generated
My email communication is concise and impactful.,generated_by_templates,communication,generated
I communicate without creating confusion rather than sending lengthy emails.,generated_by_templates,communication,generated
"When during project discussions, I ask questions with empathy.",generated_by_templates,communication,generated
I find it easy to negotiate even when in stressful situations.,generated_by_templates,communication,generated
I effectively express ideas when in cross-cultural settings.,generated_by_templates,communication,generated
I provide feedback remote teams without creating confusion.,generated_by_templates,communication,generated
I mediate discussions via video conferences tactfully.,generated_by_templates,communication,generated
I can convey messages stakeholders without being misunderstood.,generated_by_templates,communication,generated
I effectively communicate when in cross-cultural settings.,generated_by_templates,communication,generated
I am skilled at negotiate effectively.,generated_by_templates,communication,generated
I explain concepts in status reports in a timely manner.,generated_by_templates,communication,generated
I can share information clients without creating unnecessary tension.,generated_by_templates,communication,generated
"During strategy meetings, I articulate thoughts while maintaining attention.",generated_by_templates,communication,generated
I convey messages cross-functional teams in a persuasive way.,generated_by_templates,communication,generated
My crisis communication is culturally sensitive.,generated_by_templates,communication,generated
My technical communication is engaging and persuasive.,generated_by_templates,communication,generated
I clarify misunderstandings management proactively.,generated_by_templates,communication,generated
"During stakeholder meetings, I negotiate in a structured manner.",generated_by_templates,communication,generated
My presentation communication is audience-appropriate.,generated_by_templates,communication,generated
I find it easy to facilitate conversations even when dealing with complex topics.,generated_by_templates,communication,generated
I clarify misunderstandings in status reports with empathy.,generated_by_templates,communication,generated
I find it easy to express ideas even when in stressful situations.,generated_by_templates,communication,generated
I am skilled at negotiate with confidence.,generated_by_templates,communication,generated
I find it easy to mediate discussions even when handling objections.,generated_by_templates,communication,generated
I can convey messages clients without using too much jargon.,generated_by_templates,communication,generated
I can listen remote teams without overlooking cultural sensitivities.,generated_by_templates,communication,generated
I effectively provide feedback when during performance reviews.,generated_by_templates,communication,generated
I share information through email effectively.,generated_by_templates,communication,generated
I effectively persuade when in cross-cultural settings.,generated_by_templates,communication,generated
"When in team brainstorming, I provide feedback with confidence.",generated_by_templates,communication,generated
I am skilled at communicate with empathy.,generated_by_templates,communication,generated
"When in conflict situations, I mediate discussions in a structured manner.",generated_by_templates,communication,generated
I can facilitate conversations management without missing important feedback.,generated_by_templates,communication,generated
I regularly champion change to ensure operational excellence.,generated_by_templates,leadership,generated
"When facing team conflicts, I adapt my approach.",generated_by_templates,leadership,generated
My leadership style emphasizes results while maintaining accountability.,generated_by_templates,leadership,generated
My leadership style emphasizes process improvement while maintaining accountability.,generated_by_templates,leadership,generated
I empower others to drive innovation.,generated_by_templates,leadership,generated
I am effective at addressing conflicts in remote work environments.,generated_by_templates,leadership,generated
"When projects fall behind schedule, I provide additional guidance.",generated_by_templates,leadership,generated
My team members would say I support their professional development.,generated_by_templates,leadership,generated
I am effective at coaching team members in organizational changes.,generated_by_templates,leadership,generated
I guide team members who show exceptional talent.,generated_by_templates,leadership,generated
My leadership style emphasizes results while maintaining big-picture thinking.,generated_by_templates,leadership,generated
I recognize achievements to overcome obstacles.,generated_by_templates,leadership,generated
"When facing tight deadlines, I make decisive judgments.",generated_by_templates,leadership,generated
I direct team members who demonstrate initiative.,generated_by_templates,leadership,generated
I deliberately establish trust to ensure organizational alignment.,generated_by_templates,leadership,generated
"When projects face unexpected obstacles, I reallocate resources.",generated_by_templates,leadership,generated
"When facing tight deadlines, I provide additional support.",generated_by_templates,leadership,generated
I create an environment where diverse perspectives are valued.,generated_by_templates,leadership,generated
I mentor team members who need development.,generated_by_templates,leadership,generated
"When facing communication breakdowns, I make decisive judgments.",generated_by_templates,leadership,generated
"When facing resistance to change, I facilitate collaboration.",generated_by_templates,leadership,generated
I set clear expectations to increase engagement.,generated_by_templates,leadership,generated
I support team members who face personal challenges.,generated_by_templates,leadership,generated
My team members would say I inspire them to do their best work.,generated_by_templates,leadership,generated
I deliberately provide constructive feedback to ensure individual growth.,generated_by_templates,leadership,generated
"When facing tight deadlines, I remain calm and focused.",generated_by_templates,leadership,generated
I can build consensus even when managing conflicting priorities.,generated_by_templates,leadership,generated
I proactively build consensus to ensure high-quality outcomes.,generated_by_templates,leadership,generated
My team members would say I provide clear direction.,generated_by_templates,leadership,generated
I motivate team members to develop future leaders.,generated_by_templates,leadership,generated
"When projects need additional resources, I reallocate resources.",generated_by_templates,leadership,generated
"When facing organizational changes, I provide additional support.",generated_by_templates,leadership,generated
My leadership style emphasizes strategic thinking while maintaining big-picture thinking.,generated_by_templates,leadership,generated
I can establish trust even when managing conflicting priorities.,generated_by_templates,leadership,generated
I direct team members who disagree with team direction.,generated_by_templates,leadership,generated
I create an environment where mistakes are viewed as learning opportunities.,generated_by_templates,leadership,generated
"When projects exceed expectations, I facilitate problem-solving sessions.",generated_by_templates,leadership,generated
I regularly delegate responsibilities to ensure innovation.,generated_by_templates,leadership,generated
I direct team members who show exceptional talent.,generated_by_templates,leadership,generated
I am effective at building consensus in cross-functional projects.,generated_by_templates,leadership,generated
I am effective at coaching team members in high-pressure situations.,generated_by_templates,leadership,generated
My leadership style emphasizes process improvement while maintaining work-life balance.,generated_by_templates,leadership,generated
My leadership style emphasizes relationship building while maintaining attention to detail.,generated_by_templates,leadership,generated
I systematically provide constructive feedback to ensure employee satisfaction.,generated_by_templates,leadership,generated
"When facing resistance to change, I provide additional support.",generated_by_templates,leadership,generated
I challenge team members who are underperforming.,generated_by_templates,leadership,generated
I empower others to enhance collaboration.,generated_by_templates,leadership,generated
I create an environment where innovation is rewarded.,generated_by_templates,leadership,generated
I recognize achievements to resolve conflicts.,generated_by_templates,leadership,generated
I create an environment where individual strengths are leveraged.,generated_by_templates,leadership,generated
I routinely avoid social media distractions by using productivity tools.,generated_by_templates,time_management,generated
I can handle multiple priorities without becoming overwhelmed.,generated_by_templates,time_management,generated
I track time usage to balance multiple responsibilities.,generated_by_templates,time_management,generated
I routinely avoid constant email checking by establishing clear boundaries.,generated_by_templates,time_management,generated
My approach to multiple deadlines involves batching similar tasks.,generated_by_templates,time_management,generated
My approach to long-term projects involves using templates for recurring work.,generated_by_templates,time_management,generated
I methodically avoid disorganized workspaces by implementing specific routines.,generated_by_templates,time_management,generated
My approach to unexpected work involves using templates for recurring work.,generated_by_templates,time_management,generated
I systematically avoid unproductive conversations by establishing clear boundaries.,generated_by_templates,time_management,generated
I can meet tight deadlines without sacrificing quality.,generated_by_templates,time_management,generated
"When dealing with shifting priorities, I find efficient shortcuts.",generated_by_templates,time_management,generated
I track time usage to reduce stress.,generated_by_templates,time_management,generated
I review my calendar at the before meetings of each workday.,generated_by_templates,time_management,generated
My approach to decision-making involves the Pomodoro technique.,generated_by_templates,time_management,generated
I can adapt to changing schedules without missing important details.,generated_by_templates,time_management,generated
"When dealing with complex projects, I eliminate non-essential tasks.",generated_by_templates,time_management,generated
I prepare for upcoming tasks at the after lunch of each workday.,generated_by_templates,time_management,generated
My approach to long-term projects involves prioritization matrices.,generated_by_templates,time_management,generated
My approach to planning processes involves using templates for recurring work.,generated_by_templates,time_management,generated
My approach to busy periods involves saying no to low-value requests.,generated_by_templates,time_management,generated
I systematically avoid multitasking by using productivity tools.,generated_by_templates,time_management,generated
I can meet tight deadlines without neglecting self-care.,generated_by_templates,time_management,generated
I can complete important tasks first without delaying important decisions.,generated_by_templates,time_management,generated
I maintain effective time allocation by setting boundaries.,generated_by_templates,time_management,generated
"When faced with multiple simultaneous deadlines, I simplify deliverables when possible.",generated_by_templates,time_management,generated
I effectively tracking my time usage when during peak workloads.,generated_by_templates,time_management,generated
"When faced with dependent tasks delayed by others, I seek additional resources.",generated_by_templates,time_management,generated
"When faced with dependent tasks delayed by others, I focus on the most critical deliverables first.",generated_by_templates,time_management,generated
I maintain energy for important tasks by creating routines.,generated_by_templates,time_management,generated
I between major tasks batch similar tasks to maximize productivity.,generated_by_templates,time_management,generated
I can identify time-wasting activities without neglecting self-care.,generated_by_templates,time_management,generated
I prioritize tasks to achieve work-life balance.,generated_by_templates,time_management,generated
I maintain to-do lists to maximize productivity.,generated_by_templates,time_management,generated
I effectively estimating task duration when deadlines change.,generated_by_templates,time_management,generated
My approach to multiple deadlines involves prioritization matrices.,generated_by_templates,time_management,generated
I methodically avoid multitasking by blocking distracting websites.,generated_by_templates,time_management,generated
I deliberately avoid social media distractions by implementing specific routines.,generated_by_templates,time_management,generated
My approach to planning processes involves time-blocking.,generated_by_templates,time_management,generated
I can handle multiple priorities without sacrificing quality.,generated_by_templates,time_management,generated
I prioritize tasks to balance multiple responsibilities.,generated_by_templates,time_management,generated
I daily review progress regularly to maximize productivity.,generated_by_templates,time_management,generated
I review my calendar at the between focused work sessions of each workday.,generated_by_templates,time_management,generated
I delegate effectively to balance multiple responsibilities.,generated_by_templates,time_management,generated
I regularly eliminate low-value activities to maximize productivity.,generated_by_templates,time_management,generated
"When dealing with scope creep, I find efficient shortcuts.",generated_by_templates,time_management,generated
My approach to multiple deadlines involves time-blocking.,generated_by_templates,time_management,generated
I regularly break large tasks into smaller steps to maximize productivity.,generated_by_templates,time_management,generated
I consistently schedule buffer time to maximize productivity.,generated_by_templates,time_management,generated
I effectively tracking my time usage when handling multiple projects.,generated_by_templates,time_management,generated
I effectively managing multiple deadlines when priorities shift.,generated_by_templates,time_management,generated
I can translate complex information to clarify complex relationships.,generated_by_templates,analytical,generated
"When presented with legacy assumptions, I apply logical frameworks before making decisions.",generated_by_templates,analytical,generated
I can synthesize complex information to enable stakeholder understanding.,generated_by_templates,analytical,generated
I am skilled at distinguishing facts from assumptions to identify improvement opportunities.,generated_by_templates,analytical,generated
I can effectively construct logic models to solve complex problems.,generated_by_templates,analytical,generated
I am skilled at interpreting data to understand root causes.,generated_by_templates,analytical,generated
I can distill complex information to communicate key insights.,generated_by_templates,analytical,generated
I can effectively use data visualization to validate hypotheses.,generated_by_templates,analytical,generated
"When presented with conflicting information, I apply logical frameworks before establishing measurement criteria.",generated_by_templates,analytical,generated
My approach to strategic problems involves identifying underlying patterns.,generated_by_templates,analytical,generated
"When analyzing data, I quantify impacts thoroughly.",generated_by_templates,analytical,generated
"When data shows skewed distributions, I typically look for contextual factors.",generated_by_templates,analytical,generated
I methodically seek disconfirming evidence when solving problems.,generated_by_templates,analytical,generated
"When data shows contradictory indicators, I typically consider alternative interpretations.",generated_by_templates,analytical,generated
"When analyzing process inefficiencies, I quantify impacts using established frameworks.",generated_by_templates,analytical,generated
My approach to process optimization problems involves identifying underlying patterns.,generated_by_templates,analytical,generated
I can structure complex information to highlight critical factors.,generated_by_templates,analytical,generated
My approach to data-intensive problems involves testing multiple hypotheses.,generated_by_templates,analytical,generated
I test multiple data sources before finalizing a course of action.,generated_by_templates,analytical,generated
I routinely consider alternative explanations when solving problems.,generated_by_templates,analytical,generated
I am skilled at identifying connections to identify improvement opportunities.,generated_by_templates,analytical,generated
"When data shows correlation between variables, I typically consider alternative interpretations.",generated_by_templates,analytical,generated
"When presented with multiple variables, I validate data quality before drawing conclusions.",generated_by_templates,analytical,generated
I can effectively construct logic models to support strategic goals.,generated_by_templates,analytical,generated
My critical thinking helps me overcome information overload.,generated_by_templates,analytical,generated
My approach to process optimization problems involves using both deductive and inductive reasoning.,generated_by_templates,analytical,generated
I validate multiple data sources before implementing solutions.,generated_by_templates,analytical,generated
I weigh multiple assumptions before finalizing a course of action.,generated_by_templates,analytical,generated
I test multiple options before implementing solutions.,generated_by_templates,analytical,generated
My approach to time-sensitive problems involves applying structured frameworks.,generated_by_templates,analytical,generated
I can distill complex information to facilitate decision making.,generated_by_templates,analytical,generated
"When data shows correlation between variables, I typically perform additional analysis.",generated_by_templates,analytical,generated
"When analyzing complex situations, I evaluate options objectively.",generated_by_templates,analytical,generated
I assess multiple data sources before communicating results.,generated_by_templates,analytical,generated
"When presented with conflicting information, I calculate probabilities before developing predictive models.",generated_by_templates,analytical,generated
My quantitative analysis helps me overcome ambiguous problems.,generated_by_templates,analytical,generated
I can organize complex information to communicate key insights.,generated_by_templates,analytical,generated
"When data shows conflicting trends, I typically investigate potential causes.",generated_by_templates,analytical,generated
"When data shows cyclical patterns, I typically investigate potential causes.",generated_by_templates,analytical,generated
"When presented with uncertain conditions, I map interdependencies before developing predictive models.",generated_by_templates,analytical,generated
I compare multiple methodologies before committing resources.,generated_by_templates,analytical,generated
"When analyzing project requirements, I draw logical conclusions systematically.",generated_by_templates,analytical,generated
I routinely use structured problem-solving methods when solving problems.,generated_by_templates,analytical,generated
I test multiple approaches before implementing solutions.,generated_by_templates,analytical,generated
I can structure complex information to facilitate decision making.,generated_by_templates,analytical,generated
I can effectively create decision matrices to eliminate inefficiencies.,generated_by_templates,analytical,generated
I am skilled at evaluating evidence to make informed decisions.,generated_by_templates,analytical,generated
My approach to process optimization problems involves applying structured frameworks.,generated_by_templates,analytical,generated
"When analyzing market trends, I evaluate options considering multiple perspectives.",generated_by_templates,analytical,generated
I methodically use structured problem-solving methods when solving problems.,generated_by_templates,analytical,generated
