competency,question,answer1,answer2,answer3,answer4
Creativity,You are creative and inspirational.,Needs Improvement,Meets Minimum Standards,Is Proficient,Role Model
Creativity,You create a lot of new ideas.,Needs Improvement,Meets Minimum Standards,Is Proficient,Role Model
Creativity,You are creative.,Needs Improvement,Meets Minimum Standards,Is Proficient,Role Model
Creativity,You add value to the department/organization.,Needs Improvement,Meets Minimum Standards,Is Proficient,Role Model
Creativity,"You conceive, implement and evaluate ideas.",Needs Improvement,Meets Minimum Standards,Is Proficient,Role Model
Creativity,You develop solutions to challenging problems.,Needs Improvement,Meets Minimum Standards,Is Proficient,Role Model
Creativity,You work at a quick pace.,Needs Improvement,Meets Minimum Standards,Is Proficient,Role Model
Creativity,You prepare equipment at the start of the shift.,Needs Improvement,Meets Minimum Standards,Is Proficient,Role Model
Creativity,I take steps to prepare for the start of the project.,Needs Improvement,Meets Minimum Standards,Is Proficient,Role Model
Creativity,I take advantage of changes to the current situation.,Needs Improvement,Meets Minimum Standards,Is Proficient,Role Model
Creativity,I take proactive steps to address potential issues before they become a problem.,Needs Improvement,Meets Minimum Standards,Is Proficient,Role Model
Creativity,You avoid procrastinating.,Needs Improvement,Meets Minimum Standards,Is Proficient,Role Model
Creativity,"You give direct, constructive, and actionable feedback.",Needs Improvement,Meets Minimum Standards,Is Proficient,Role Model
Creativity,You recognize individual and team accomplishments and reward them appropriately.,Needs Improvement,Meets Minimum Standards,Is Proficient,Role Model
Creativity,You communicate calmly and honestly even when stressed.,Needs Improvement,Meets Minimum Standards,Is Proficient,Role Model
Creativity,You give inspiring presentations or discussions.,Needs Improvement,Meets Minimum Standards,Is Proficient,Role Model
Creativity,You provide structure.,Needs Improvement,Meets Minimum Standards,Is Proficient,Role Model
Creativity,You influence the decisions made at the Company.,Needs Improvement,Meets Minimum Standards,Is Proficient,Role Model
Creativity,You use timely and appropriate corrective/disciplinary actions.,Needs Improvement,Meets Minimum Standards,Is Proficient,Role Model
Creativity,You set specific and measurable goals for others and follows through to completion.,Needs Improvement,Meets Minimum Standards,Is Proficient,Role Model
Creativity,I implement remediation plans as needed.,Needs Improvement,Meets Minimum Standards,Is Proficient,Role Model
Creativity,You identify specific actions to be addressed through the remediation plan.,Needs Improvement,Meets Minimum Standards,Is Proficient,Role Model
Creativity,I review monthly or weekly reports of quantitative metrics (sales/production) to measure performance level.,Needs Improvement,Meets Minimum Standards,Is Proficient,Role Model
Creativity,You recognize and value good performance.,Needs Improvement,Meets Minimum Standards,Is Proficient,Role Model
Creativity,You have strong organizational skills to keep the workspace and department in order,Needs Improvement,Meets Minimum Standards,Is Proficient,Role Model
Creativity,"You are able to develop, justify and present a budget.",Needs Improvement,Meets Minimum Standards,Is Proficient,Role Model
Creativity,You take responsibility for decisions.,Needs Improvement,Meets Minimum Standards,Is Proficient,Role Model
Creativity,You complete reports on-time.,Needs Improvement,Meets Minimum Standards,Is Proficient,Role Model
Creativity,You are enthusiastic about taking on challenging projects.,Needs Improvement,Meets Minimum Standards,Is Proficient,Role Model
Creativity,You accurately implement contract provisions.,Needs Improvement,Meets Minimum Standards,Is Proficient,Role Model
Creativity,You manage impact of increased traffic flow and freight receipt by detailed planning of controllables and by anticipating and reacting positively to uncontrollables.,Needs Improvement,Meets Minimum Standards,Is Proficient,Role Model
Creativity,"You bounce back from daily crisis, disappointments and frustrations.",Needs Improvement,Meets Minimum Standards,Is Proficient,Role Model
Creativity,You consistently use a scheduler/planner.,Needs Improvement,Meets Minimum Standards,Is Proficient,Role Model
Creativity,You are aware of the schedule and the importance of being on-time.,Needs Improvement,Meets Minimum Standards,Is Proficient,Role Model
Creativity,You effectively manage time to stay on schedule.,Needs Improvement,Meets Minimum Standards,Is Proficient,Role Model
Creativity,You plan and organize continuously while performing all other responsibilities and activities.,Needs Improvement,Meets Minimum Standards,Is Proficient,Role Model
Creativity,You use technology in decision making and problem solving.,Needs Improvement,Meets Minimum Standards,Is Proficient,Role Model
Creativity,You maximize the use of new technology to deliver products and services.,Needs Improvement,Meets Minimum Standards,Is Proficient,Role Model
Creativity,You are proficient in the use of technical systems and processes.,Needs Improvement,Meets Minimum Standards,Is Proficient,Role Model
Creativity,You adopt the implementation of new technology into the workplace.,Needs Improvement,Meets Minimum Standards,Is Proficient,Role Model
Creativity,You apply complex rules and regulations to maintain optimal system performance.,Needs Improvement,Meets Minimum Standards,Is Proficient,Role Model
Creativity,You identify gaps between actual and needed technical competencies and provide recommendations for required training.,Needs Improvement,Meets Minimum Standards,Is Proficient,Role Model
Creativity,You set high personal standards of performance.,Needs Improvement,Meets Minimum Standards,Is Proficient,Role Model
Creativity,You set a good example,Needs Improvement,Meets Minimum Standards,Is Proficient,Role Model
Creativity,You act as a resource without removing individual responsibility.,Needs Improvement,Meets Minimum Standards,Is Proficient,Role Model
Creativity,You take personal responsibility for results.,Needs Improvement,Meets Minimum Standards,Is Proficient,Role Model
Creativity,You set a good example.,Needs Improvement,Meets Minimum Standards,Is Proficient,Role Model
Creativity,You complete assigned work tasks.,Needs Improvement,Meets Minimum Standards,Is Proficient,Role Model
Creativity,You support the successes of other employees.,Needs Improvement,Meets Minimum Standards,Is Proficient,Role Model
Creativity,You try to ensure employees are ready to move to the next level.,Needs Improvement,Meets Minimum Standards,Is Proficient,Role Model
Creativity,You set performance objectives for subordinates that encourages development opportunities.,Needs Improvement,Meets Minimum Standards,Is Proficient,Role Model
Creativity,You create a work environment that fosters positive feedback to employees.,Needs Improvement,Meets Minimum Standards,Is Proficient,Role Model
Creativity,You encourage employees through recognition of positive changes in behavior.,Needs Improvement,Meets Minimum Standards,Is Proficient,Role Model
Creativity,You create opportunities for professional development.,Needs Improvement,Meets Minimum Standards,Is Proficient,Role Model
Creativity,I prevent minor issues from escalating into major problems.,Needs Improvement,Meets Minimum Standards,Is Proficient,Role Model
Creativity,You combine different ideas and viewpoints.,Needs Improvement,Meets Minimum Standards,Is Proficient,Role Model
Creativity,I ensure that the basic needs of each party are satisfied.,Needs Improvement,Meets Minimum Standards,Is Proficient,Role Model
Creativity,I steer the process towards compromise and conflict resolution.,Needs Improvement,Meets Minimum Standards,Is Proficient,Role Model
Creativity,You help others avoid misperceptions.,Needs Improvement,Meets Minimum Standards,Is Proficient,Role Model
Creativity,I encourage individuals to seek areas of common ground.,Needs Improvement,Meets Minimum Standards,Is Proficient,Role Model
Creativity,Is creative.,Clear Strength,Capable and Effective,Could Benefit from Development,Needs Significant Improvement
Creativity,Inspires creativity in their team.,Clear Strength,Capable and Effective,Could Benefit from Development,Needs Significant Improvement
Creativity,Adds value to the department/organization.,Clear Strength,Capable and Effective,Could Benefit from Development,Needs Significant Improvement
Creativity,"Conceives, implements and evaluates ideas.",Clear Strength,Capable and Effective,Could Benefit from Development,Needs Significant Improvement
Creativity,Develops solutions to challenging problems.,Clear Strength,Capable and Effective,Could Benefit from Development,Needs Significant Improvement
Creativity,"Confidently communicates across all organizational levels, including external stakeholders.",Clear Strength,Capable and Effective,Could Benefit from Development,Needs Significant Improvement
Creativity,Communicates the vision of the organization to all employees.,Clear Strength,Capable and Effective,Could Benefit from Development,Needs Significant Improvement
Creativity,Listens attentively and without interrupting team members and customers,Clear Strength,Capable and Effective,Could Benefit from Development,Needs Significant Improvement
Creativity,Makes eye contact with the person they are speaking with.,Clear Strength,Capable and Effective,Could Benefit from Development,Needs Significant Improvement
Creativity,Welcomes input and suggestions from others.,Clear Strength,Capable and Effective,Could Benefit from Development,Needs Significant Improvement
Creativity,Looks for ways to expand and learn new job skills.,Clear Strength,Capable and Effective,Could Benefit from Development,Needs Significant Improvement
Creativity,Looks for ways to improve work processes and procedures.,Clear Strength,Capable and Effective,Could Benefit from Development,Needs Significant Improvement
Creativity,Analyzes processes to determine areas for improvement.,Clear Strength,Capable and Effective,Could Benefit from Development,Needs Significant Improvement
Creativity,"Searches for new methods, techniques, and processes that increase efficiency and reduce costs.",Clear Strength,Capable and Effective,Could Benefit from Development,Needs Significant Improvement
Creativity,Encourages an employee culture of continuous improvement to seek out better ways of doing things.,Clear Strength,Capable and Effective,Could Benefit from Development,Needs Significant Improvement
Creativity,Starts meetings on time.,Clear Strength,Capable and Effective,Could Benefit from Development,Needs Significant Improvement
Creativity,Arrives to meetings on time.,Clear Strength,Capable and Effective,Could Benefit from Development,Needs Significant Improvement
Creativity,Starts the workday when scheduled.,Clear Strength,Capable and Effective,Could Benefit from Development,Needs Significant Improvement
Creativity,Responds to requests for information in a timely manner.,Clear Strength,Capable and Effective,Could Benefit from Development,Needs Significant Improvement
Creativity,Conducts appointments at scheduled start time.,Clear Strength,Capable and Effective,Could Benefit from Development,Needs Significant Improvement
Creativity,Is open to listening to others who may have different ideas.,Clear Strength,Capable and Effective,Could Benefit from Development,Needs Significant Improvement
Creativity,Evaluates information before making a final decision.,Clear Strength,Capable and Effective,Could Benefit from Development,Needs Significant Improvement
Creativity,Makes decisions independently (without having to be told what or how).,Clear Strength,Capable and Effective,Could Benefit from Development,Needs Significant Improvement
Creativity,Makes good decisions for the department.,Clear Strength,Capable and Effective,Could Benefit from Development,Needs Significant Improvement
Creativity,Makes creative decisions.,Clear Strength,Capable and Effective,Could Benefit from Development,Needs Significant Improvement
Creativity,Willingly shares his/her technical expertise; sought out as resource by others,Clear Strength,Capable and Effective,Could Benefit from Development,Needs Significant Improvement
Creativity,Keeps current with technical advances within his/her professional discipline; embraces and applies new techniques and practices,Clear Strength,Capable and Effective,Could Benefit from Development,Needs Significant Improvement
Creativity,Seeks information from others as needed.,Clear Strength,Capable and Effective,Could Benefit from Development,Needs Significant Improvement
Creativity,Willingly shares information and expertise; sought out as resource by others,Clear Strength,Capable and Effective,Could Benefit from Development,Needs Significant Improvement
Creativity,Knows how to produce high quality products/work.,Clear Strength,Capable and Effective,Could Benefit from Development,Needs Significant Improvement
Creativity,Identifies predictable hazards in the workplace.,Clear Strength,Capable and Effective,Could Benefit from Development,Needs Significant Improvement
Creativity,Keeps accurate safety records.,Clear Strength,Capable and Effective,Could Benefit from Development,Needs Significant Improvement
Creativity,Participates in safety training when offered.,Clear Strength,Capable and Effective,Could Benefit from Development,Needs Significant Improvement
Creativity,Mitigates hazards and safety issues that arise.,Clear Strength,Capable and Effective,Could Benefit from Development,Needs Significant Improvement
Creativity,Supports safety programs and procedures.,Clear Strength,Capable and Effective,Could Benefit from Development,Needs Significant Improvement
Creativity,Demonstrates a sense of responsibility and commitment to public trust.,Clear Strength,Capable and Effective,Could Benefit from Development,Needs Significant Improvement
Creativity,"Communicates an understanding of the other person's interests, needs and concerns.",Clear Strength,Capable and Effective,Could Benefit from Development,Needs Significant Improvement
Creativity,Consistently keeps commitments.,Clear Strength,Capable and Effective,Could Benefit from Development,Needs Significant Improvement
Creativity,Delivers on promises made.,Clear Strength,Capable and Effective,Could Benefit from Development,Needs Significant Improvement
Creativity,Takes care to maintain confidential information.,Clear Strength,Capable and Effective,Could Benefit from Development,Needs Significant Improvement
Creativity,Maintains good interpersonal relationships with representatives from the other party.,Clear Strength,Capable and Effective,Could Benefit from Development,Needs Significant Improvement
Creativity,Able to adapt to dynamic situations created by new information or unexpected challenges.,Clear Strength,Capable and Effective,Could Benefit from Development,Needs Significant Improvement
Creativity,Justifies viewpoints using strong and credible data.,Clear Strength,Capable and Effective,Could Benefit from Development,Needs Significant Improvement
Creativity,Influences others through rational argument and persuasion.,Clear Strength,Capable and Effective,Could Benefit from Development,Needs Significant Improvement
Creativity,Engages in questioning to obtain necessary information and examine various alternatives.,Clear Strength,Capable and Effective,Could Benefit from Development,Needs Significant Improvement
Creativity,Analyzes current business practices to make better informed decisions.,Clear Strength,Capable and Effective,Could Benefit from Development,Needs Significant Improvement
Creativity,Shares information among teams and departments.,Clear Strength,Capable and Effective,Could Benefit from Development,Needs Significant Improvement
Creativity,Identifies new business opportunities.,Clear Strength,Capable and Effective,Could Benefit from Development,Needs Significant Improvement
Creativity,Able to correctly assess current/estimated valuations.,Clear Strength,Capable and Effective,Could Benefit from Development,Needs Significant Improvement
Creativity,"Conducts thorough market research to understand industry trends, customer needs, and competitive landscapes.",Clear Strength,Capable and Effective,Could Benefit from Development,Needs Significant Improvement
Creativity,Creates and executes a strategic vision that drives the company's growth forward.,Clear Strength,Capable and Effective,Could Benefit from Development,Needs Significant Improvement
Creativity,Fosters a leadership vision that promotes innovation and growth.,Clear Strength,Capable and Effective,Could Benefit from Development,Needs Significant Improvement
Creativity,Supports a culture of the department that is willing to implement the company's vision.,Clear Strength,Capable and Effective,Could Benefit from Development,Needs Significant Improvement
Creativity,Clearly articulates a vision for his/her work and inspires others to support it,Clear Strength,Capable and Effective,Could Benefit from Development,Needs Significant Improvement
Creativity,Develops an inspiring and ambitious vision of growth for the organization's future.,Clear Strength,Capable and Effective,Could Benefit from Development,Needs Significant Improvement
Creativity,Adds value to the department/organization.,Does Not Exhibit this Competency,Seldom Exhibits this Competency,Sometimes Exhibits this Competency,Usually Exhibits this Competency
Creativity,Creates a lot of new ideas.,Does Not Exhibit this Competency,Seldom Exhibits this Competency,Sometimes Exhibits this Competency,Usually Exhibits this Competency
Creativity,Inspires creativity in their team.,Does Not Exhibit this Competency,Seldom Exhibits this Competency,Sometimes Exhibits this Competency,Usually Exhibits this Competency
Creativity,"Conceives, implements and evaluates ideas.",Does Not Exhibit this Competency,Seldom Exhibits this Competency,Sometimes Exhibits this Competency,Usually Exhibits this Competency
Creativity,Is creative.,Does Not Exhibit this Competency,Seldom Exhibits this Competency,Sometimes Exhibits this Competency,Usually Exhibits this Competency
Creativity,Seeks to enhance the performance of employees under their supervision.,Does Not Exhibit this Competency,Seldom Exhibits this Competency,Sometimes Exhibits this Competency,Usually Exhibits this Competency
Creativity,Works well with the team members.,Does Not Exhibit this Competency,Seldom Exhibits this Competency,Sometimes Exhibits this Competency,Usually Exhibits this Competency
Creativity,Provides clear expectations of outcomes during performance reviews.,Does Not Exhibit this Competency,Seldom Exhibits this Competency,Sometimes Exhibits this Competency,Usually Exhibits this Competency
Creativity,Provides direction and coaching to employees.,Does Not Exhibit this Competency,Seldom Exhibits this Competency,Sometimes Exhibits this Competency,Usually Exhibits this Competency
Creativity,Encourages employees to take responsibility for mistakes.,Does Not Exhibit this Competency,Seldom Exhibits this Competency,Sometimes Exhibits this Competency,Usually Exhibits this Competency
Creativity,Defines goals and objectives for subordinates.,Does Not Exhibit this Competency,Seldom Exhibits this Competency,Sometimes Exhibits this Competency,Usually Exhibits this Competency
Creativity,Sets clear and reasonable expectations for others and follows through on their progress.,Does Not Exhibit this Competency,Seldom Exhibits this Competency,Sometimes Exhibits this Competency,Usually Exhibits this Competency
Creativity,"Tells subordinates what to do, not how to do it.",Does Not Exhibit this Competency,Seldom Exhibits this Competency,Sometimes Exhibits this Competency,Usually Exhibits this Competency
Creativity,Encourages and empowers subordinates to use initiative in achieving goals and objectives.,Does Not Exhibit this Competency,Seldom Exhibits this Competency,Sometimes Exhibits this Competency,Usually Exhibits this Competency
Creativity,"Defines the roles, responsibilities, required actions, and deadlines for team members.",Does Not Exhibit this Competency,Seldom Exhibits this Competency,Sometimes Exhibits this Competency,Usually Exhibits this Competency
Creativity,Maintains detailed instructions to ensure consistency and quality in the production line.,Does Not Exhibit this Competency,Seldom Exhibits this Competency,Sometimes Exhibits this Competency,Usually Exhibits this Competency
Creativity,Implements appropriate training to maintain high quality standards.,Does Not Exhibit this Competency,Seldom Exhibits this Competency,Sometimes Exhibits this Competency,Usually Exhibits this Competency
Creativity,Assesses strengths and weaknesses of various quality initiatives.,Does Not Exhibit this Competency,Seldom Exhibits this Competency,Sometimes Exhibits this Competency,Usually Exhibits this Competency
Creativity,Able to anticipate quality issues and take preventative actions.,Does Not Exhibit this Competency,Seldom Exhibits this Competency,Sometimes Exhibits this Competency,Usually Exhibits this Competency
Creativity,Ensures high consistency across batches or production runs.,Does Not Exhibit this Competency,Seldom Exhibits this Competency,Sometimes Exhibits this Competency,Usually Exhibits this Competency
Creativity,Takes advantage of opportunities when they become available.,Does Not Exhibit this Competency,Seldom Exhibits this Competency,Sometimes Exhibits this Competency,Usually Exhibits this Competency
Creativity,Actively works on resolving the issue instead of procrastinating or hoping it will resolve itself.,Does Not Exhibit this Competency,Seldom Exhibits this Competency,Sometimes Exhibits this Competency,Usually Exhibits this Competency
Creativity,Acts with urgency when time is limited.,Does Not Exhibit this Competency,Seldom Exhibits this Competency,Sometimes Exhibits this Competency,Usually Exhibits this Competency
Creativity,Encourages others on the team to suggest process improvements.,Does Not Exhibit this Competency,Seldom Exhibits this Competency,Sometimes Exhibits this Competency,Usually Exhibits this Competency
Creativity,Takes the initiative to solve pressing issues.,Does Not Exhibit this Competency,Seldom Exhibits this Competency,Sometimes Exhibits this Competency,Usually Exhibits this Competency
Creativity,Addresses employee behavior problems effectively.,Does Not Exhibit this Competency,Seldom Exhibits this Competency,Sometimes Exhibits this Competency,Usually Exhibits this Competency
Creativity,Conducts regular performance appraisals and feedback.,Does Not Exhibit this Competency,Seldom Exhibits this Competency,Sometimes Exhibits this Competency,Usually Exhibits this Competency
Creativity,"Helps employees to understand responsibilities, authority, and expectations.",Does Not Exhibit this Competency,Seldom Exhibits this Competency,Sometimes Exhibits this Competency,Usually Exhibits this Competency
Creativity,Helps employees to maintain high personal standards.,Does Not Exhibit this Competency,Seldom Exhibits this Competency,Sometimes Exhibits this Competency,Usually Exhibits this Competency
Creativity,"Provides clear, motivating, and constructive feedback.",Does Not Exhibit this Competency,Seldom Exhibits this Competency,Sometimes Exhibits this Competency,Usually Exhibits this Competency
Creativity,Takes the initiative to complete tasks.,Does Not Exhibit this Competency,Seldom Exhibits this Competency,Sometimes Exhibits this Competency,Usually Exhibits this Competency
Creativity,Balances risks and rewards when making decisions.,Does Not Exhibit this Competency,Seldom Exhibits this Competency,Sometimes Exhibits this Competency,Usually Exhibits this Competency
Creativity,Understands the processes and various stages of business development.,Does Not Exhibit this Competency,Seldom Exhibits this Competency,Sometimes Exhibits this Competency,Usually Exhibits this Competency
Creativity,Maintains a high level of energy to respond to demands of the job.,Does Not Exhibit this Competency,Seldom Exhibits this Competency,Sometimes Exhibits this Competency,Usually Exhibits this Competency
Creativity,Excellent at managing relationships with stakeholders.,Does Not Exhibit this Competency,Seldom Exhibits this Competency,Sometimes Exhibits this Competency,Usually Exhibits this Competency
Creativity,Understands the current organizational culture.,Does Not Exhibit this Competency,Seldom Exhibits this Competency,Sometimes Exhibits this Competency,Usually Exhibits this Competency
Creativity,Able to use corporate politics to advance department objectives.,Does Not Exhibit this Competency,Seldom Exhibits this Competency,Sometimes Exhibits this Competency,Usually Exhibits this Competency
Creativity,Effective in communicating with others within the organization.,Does Not Exhibit this Competency,Seldom Exhibits this Competency,Sometimes Exhibits this Competency,Usually Exhibits this Competency
Creativity,Gets things done through the department.,Does Not Exhibit this Competency,Seldom Exhibits this Competency,Sometimes Exhibits this Competency,Usually Exhibits this Competency
Creativity,Able to explain departmental policies and procedures to others.,Does Not Exhibit this Competency,Seldom Exhibits this Competency,Sometimes Exhibits this Competency,Usually Exhibits this Competency
Unknown,Creates a lot of new ideas.,,,,
Unknown,Inspires creativity in their team.,,,,
Unknown,"Conceives, implements and evaluates ideas.",,,,
Unknown,Is creative.,,,,
Unknown,Adds value to the department/organization.,,,,
Unknown,Keep themselves up-to-date of technical/professional issues,,,,
Unknown,Contributing fully to the extent of their skills,,,,
Unknown,Seeks opportunities for continuous learning.,,,,
